{
  "source_text": "Un laboratorio de Madrid grabo en secreto lo que le pasa a tu cuerpo a la medianoche, y casi nadie ha visto este video todavia. Llevo doce anos trabajando como enfermera de turno nocturno y esto cambio mis noches por completo. La formula combina magnesio, manzanilla y una raiz local que ayuda a relajar los musculos antes de dormir. No tomes mas de una taza, entonces tu cuerpo se relaja demasiado rapido y te puede dar mucho sueno. La primera noche sientes calor en los hombros, pero la clave llega despues de siete noches seguidas. Si no notas ningun cambio en catorce noches, te devolvemos cada centavo sin preguntas. Quedan pocas unidades de este lote, y cuando se agote el precio vuelve a subir. Toca el enlace de abajo antes de dormir esta noche.",
  "language": "es",
  "archetype": "G+E",
  "segments": [
    {
      "segment_id": 1,
      "module": "hook",
      "raw_text": "Un laboratorio de Madrid grabo en secreto lo que le pasa a tu cuerpo a la medianoche, y casi nadie ha visto este video todavia.",
      "text_annotated": "Un laboratorio de Madrid grabo en secreto · lo que le pasa a tu cuerpo a la medianoche, ‖ y casi nadie ha visto este video todavia."
    },
    {
      "segment_id": 2,
      "module": "authority",
      "raw_text": "Llevo doce anos trabajando como enfermera de turno nocturno y esto cambio mis noches por completo.",
      "text_annotated": "Llevo doce anos trabajando como enfermera · de turno nocturno ‖ y esto cambio mis noches por completo."
    },
    {
      "segment_id": 3,
      "module": "mechanism",
      "raw_text": "La formula combina magnesio, manzanilla y una raiz local que ayuda a relajar los musculos antes de dormir.",
      "text_annotated": "La formula combina magnesio, · manzanilla y una raiz local · que ayuda a relajar · los musculos antes de dormir."
    },
    {
      "segment_id": 4,
      "module": "dosage",
      "raw_text": "No tomes mas de una taza, entonces tu cuerpo se relaja demasiado rapido y te puede dar mucho sueno.",
      "text_annotated": "No tomes mas de una taza, ‖ entonces tu cuerpo se relaja · demasiado rapido ‖ y te puede dar mucho sueno."
    },
    {
      "segment_id": 5,
      "module": "staged_timeline",
      "raw_text": "La primera noche sientes calor en los hombros, pero la clave llega despues de siete noches seguidas.",
      "text_annotated": "La primera noche sientes calor en los hombros, ‖ pero la clave llega · despues de siete noches seguidas."
    },
    {
      "segment_id": 6,
      "module": "risk_reversal",
      "raw_text": "Si no notas ningun cambio en catorce noches, te devolvemos cada centavo sin preguntas.",
      "text_annotated": "Si no notas ningun cambio en catorce noches, · te devolvemos cada centavo sin preguntas."
    },
    {
      "segment_id": 7,
      "module": "scarcity",
      "raw_text": "Quedan pocas unidades de este lote, y cuando se agote el precio vuelve a subir.",
      "text_annotated": "Quedan pocas unidades de este lote, ‖ y cuando se agote el precio vuelve a subir."
    },
    {
      "segment_id": 8,
      "module": "cta",
      "raw_text": "Toca el enlace de abajo antes de dormir esta noche.",
      "text_annotated": "Toca el enlace de abajo · antes de dormir esta noche."
    }
  ],
  "shots": [
    { "shot_id": 1, "segment_refs": [1], "shot_purpose": "hook" },
    { "shot_id": 2, "segment_refs": [2], "shot_purpose": "social_proof" },
    { "shot_id": 3, "segment_refs": [3], "shot_purpose": "reveal" },
    { "shot_id": 4, "segment_refs": [4], "shot_purpose": "demo" },
    { "shot_id": 5, "segment_refs": [5], "shot_purpose": "build" },
    { "shot_id": 6, "segment_refs": [6, 7], "shot_purpose": "cta" },
    { "shot_id": 7, "segment_refs": [8], "shot_purpose": "cta" }
  ],
  "meta": {
    "generated_by": "100x-segment",
    "warnings": [],
    "eval_note": "synthetic example, not a real product or transcript"
  }
}
